George Soros gives 1 million euros to Budapest's coronavirus fight,Thestar.com.my,30/3/2020,LONDON (Reuters) - George Soros; the 89-year-old billionaire financier; said on Monday his Open Society Foundations would contribute 1 million euros (894;987.49 pounds) to Budapest's fight against coronavirus.,https://www.thestar.com.my/news/world/2020/03/30/george-soros-gives-1-million-euros-to-budapest039s-coronavirus-fight,World,,0
Vietnam asks mask firms to increase production to 5 million a day,Thestar.com.my,30/3/2020,HANOI (Reuters) - Vietnam has asked local mask producers to ramp up their production to make 5 million masks a day; the government said on Monday; as coronavirus cases in the country rise to 200.,https://www.thestar.com.my/news/world/2020/03/30/vietnam-asks-mask-firms-to-increase-production-to-5-million-a-day,World,,0
Singapore court upholds colonial-era law that criminalises sex between men,Thestar.com.my,30/3/2020,SINGAPORE (Reuters) - Singapore's high court upheld on Monday a rarely-used law that criminalises sex between men; dismissing three appeals that argued it was unconstitutional.,https://www.thestar.com.my/news/world/2020/03/30/singapore-court-upholds-colonial-era-law-that-criminalises-sex-between-men,Singapore,crime; law and justice - judiciary (system of justice),100
Coronavirus fails to dampen South Korea's fever for exam success,Thestar.com.my,30/3/2020,SEOUL (Reuters) - Choi Young-eun is so concerned about her teenagers' education as South Korea's schools stay shut that she has been sending them to a private tuition centre to make sure they don't miss out.,https://www.thestar.com.my/news/world/2020/03/30/coronavirus-fails-to-dampen-south-korea039s-fever-for-exam-success,World,sport - soccer,100
Japan has no plan to declare state of emergency April 1 - Suga,Thestar.com.my,30/3/2020,TOKYO (Reuters) - Japan's top government spokesman said on Monday there was no truth to rumours the government was planning to declare a state of emergency from April 1 to slow the spread of the coronavirus pandemic.,https://www.thestar.com.my/news/world/2020/03/30/japan-has-no-plan-to-declare-state-of-emergency-april-1---suga,World,health - epidemic and plague,100
Covid-19: M'sia records highest recovery in a day; 91 patients discharged on March 30,Thestar.com.my,30/3/2020,PUTRAJAYA: Malaysia records its highest number of Covid-19 recovery in a day; with 91 patients discharged on Monday (March 30).,https://www.thestar.com.my/news/nation/2020/03/30/covid-19-m039sia-records-highest-recovery-in-a-day-91-patients-discharged-on-march-30,World,,0
Cambodia to close casinos; halt rice exports due to Covid-19,Thestar.com.my,30/3/2020,PHNOM PENH: Cambodian Prime Minister Hun Sen on Monday (March 30) said the nation’s casinos would be closed starting Wednesday and rice exports would stop by Sunday in response to the Covid-19 (coronavirus) outbreak; state media reported.,https://www.thestar.com.my/news/regional/2020/03/30/cambodia-to-close-casinos-halt-rice-exports-due-to-covid-19,World,human interest,100
Sabah activates district disaster operations centres to check spread of Covid-19,Thestar.com.my,30/3/2020,KOTA KINABALU: Sabah has activated all its district natural disaster operations centres in anticipation of a rise in Covid-19 cases; says Chief Minister Datuk Seri Mohd Shafie Apdal.,https://www.thestar.com.my/news/nation/2020/03/30/sabah-activates-district-disaster-operations-centres-to-check-spread-of-covid-19,World,,0
Three civilians injured as rebels attack gold; copper mining firm in Indonesia's Papua,Thestar.com.my,30/3/2020,JAKARTA: Three civilians; two of them foreign nationals; were wounded as rebels opened fires at gold and copper mining firm PT Freeport Indonesia in the country's easternmost province of Papua on Monday (March 30).,https://www.thestar.com.my/news/regional/2020/03/30/three-civilians-injured-as-rebels-attack-gold-copper-mining-firm-in-indonesia039s-papua,World,economy; business and finance - metal and mineral - mining,100
Funeral parlours offering Qing Ming,Thestar.com.my,30/3/2020,PETALING JAYA: Relatives who are caught in a dilemma over the movement control order (MCO) coinciding with the annual Qing Ming festival can now pay respects to their ancestors without going out of their homes.,https://www.thestar.com.my/news/nation/2020/03/30/funeral-parlours-offering-qing-ming,World,social issue - family,100
Cambodia PM orders casinos shut down as coronavirus cases climb,Thestar.com.my,30/3/2020,PHNOM PENH (Reuters) - Cambodian Prime Minister Hun Sen on Monday ordered all casinos to close to curb the spread of the coronavirus.,https://www.thestar.com.my/news/world/2020/03/30/cambodia-pm-orders-casinos-shut-down-as-coronavirus-cases-climb,World,,0
Laos closes international checkpoints; suspends passenger transport to prevent outbreak,Thestar.com.my,30/3/2020,VIENTIANE: The Laos government said on Monday (March 30) that all international checkpoints will be closed for passengers exiting and entering Laos in its effort to contain the Covid-19 (coronavirus) outbreak. However; goods transport is still permitted.,https://www.thestar.com.my/news/regional/2020/03/30/laos-closes-international-checkpoints-suspends-passenger-transport-to-prevent-outbreak,World,,0
Disinfection of public areas begins across Johor,Thestar.com.my,30/3/2020,JOHOR BARU: Disinfection operations have begun across Johor; and Kampung Sinaran Baru here was the first place to be disinfected; following a Covid-19 positive case in the village.,https://www.thestar.com.my/news/nation/2020/03/30/disinfection-of-public-areas-begins-across-johor,World,,0
Medan Niaga Satok and Stutong markets in Kuching disinfected,Thestar.com.my,30/3/2020,KUCHING: The Medan Niaga Satok and Stutong markets here were disinfected on Monday (Mar 30) as part of the nationwide sanitisation exercise.,https://www.thestar.com.my/news/nation/2020/03/30/medan-niaga-satok-and-stutong-markets-in-kuching-disinfected,World,,0
Chinese passenger train derailed by landslide debris,Thestar.com.my,30/3/2020,SHANGHAI: A passenger train derailed after striking debris from a landslide in central China on Monday; injuring a number of passengers and staff; officials said.,https://www.thestar.com.my/news/regional/2020/03/30/chinese-passenger-train-derailed-by-landslide-debris,World,,0
MCO: UTAR providing interest free loans; instalment payment plans,Thestar.com.my,30/3/2020,PETALING JAYA: Universiti Tunku Abdul Rahman (UTAR) is providing interest free loans and instalment payment plans for its students in light of the movement control Order (MCO).,https://www.thestar.com.my/news/nation/2020/03/30/mco-utar-providing-interest-free-loans-instalment-payment-plans,World,education - teaching and learning - students,100
Sabah officials to take closer look at quarantine centres in state following hygiene complaints,Thestar.com.my,30/3/2020,KOTA KINABALU: State officials are taking a closer look at quarantine centres and are considering providing more necessities for the comfort of those required to undergo quarantine for 14 days amidst complaints of unhygienic centres.,https://www.thestar.com.my/news/nation/2020/03/30/sabah-officials-to-take-closer-look-at-quarantine-centres-in-state-following-hygiene-complaints,World,,0
Table tennis world team titles postponed again as powerhouse China continues to wait,Thestar.com.my,30/3/2020,BUSAN: The table tennis world team championships have been postponed again after the sport's governing body suspended all planned events involving international travel until June 30 amid the Covid-19 (coronavirus) pandemic.,https://www.thestar.com.my/news/regional/2020/03/30/table-tennis-world-team-titles-postponed-again-as-powerhouse-china-continues-to-wait,World,health - epidemic and plague,100
China steps up online litigation services amid coronavirus epidemic,Thestar.com.my,30/3/2020,BEIJING: Chinese courts have been urged to make full use of information technology in litigation work since the outbreak of the coronavirus; according to the Supreme People's Court (SPC).,https://www.thestar.com.my/news/regional/2020/03/30/china-steps-up-online-litigation-services-amid-coronavirus-epidemic,World,crime; law and justice - judiciary (system of justice),100
Vietnam paper suspends print edition after reporter contracts Covid-19,Thestar.com.my,30/3/2020,HANOI: VietNam News; the nation’s largest English-language newspaper; is suspending its daily print edition for over two weeks after one of its reporters was infected with the Covid-19 (coronavirus) outbreak.,https://www.thestar.com.my/news/regional/2020/03/30/vietnam-paper-suspends-print-edition-after-reporter-contracts-covid-19,World,,0
Tokyo 2020: New Olympic date likely this week,Thestar.com.my,30/3/2020,TOKYO: New dates for the delayed Tokyo 2020 Olympics will likely be revealed this week; organisers said on Monday (March 30) after the Covid-19 (coronavirus) outbreak forced the historic decision to postpone the Games until next year.,https://www.thestar.com.my/news/regional/2020/03/30/tokyo-2020-new-olympic-date-likely-this-week,World,sport - sports event - World games,100
Exclusive: U.S. investigates child labour in Ivory Coast cocoa supply chains,Thestar.com.my,30/3/2020,ABIDJAN (Reuters) - U.S. customs authorities have asked cocoa traders to report where and when they encounter child labour in their supply chains in top grower Ivory Coast; three industry sources said; following calls from American lawmakers to ban some impor…,https://www.thestar.com.my/news/world/2020/03/30/exclusive-us-investigates-child-labour-in-ivory-coast-cocoa-supply-chains,World,crime; law and justice - police,100
Contact MACC if govt aid does not come your way? That’s fake news,Thestar.com.my,30/3/2020,KUALA LUMPUR; March 30 (Bernama) -- The Malaysian Anti-Corruption Commission (MACC) says it has never issued a statement that members of the public should contact it if they did not get government aid; as said in a viral message.,https://www.thestar.com.my/news/nation/2020/03/30/contact-macc-if-govt-aid-does-not-come-your-way-thats-fake-news,World,crime; law and justice - corporate crime - corruption,100
Nabbed: Trio who tried to flee from cops in Johor,Thestar.com.my,30/3/2020,JOHOR BARU: Police have arrested three people including a woman for defying the movement control order (MCO) and trying to flee from authorities at Jalan Permas 2/4; here.,https://www.thestar.com.my/news/nation/2020/03/30/nabbed-trio-who-tried-to-flee-from-cops-in-johor,World,crime; law and justice - police - arrest,100
Face mask ceiling price set at RM1.50 per piece effective April 1,Thestar.com.my,30/3/2020,PUTRAJAYA (Bernama): The new ceiling price for face masks has been fixed at RM1.50 per piece effective April 1; the government announced Monday (March 30).March 30,https://www.thestar.com.my/news/nation/2020/03/30/face-mask-ceiling-price-set-at-rm150-per-piece-effective-april-1,World,,0
Covid-19 Asia (latest): Markets fall; Aussies in quarantine,Thestar.com.my,30/3/2020,SINGAPORE: Here are the latest developments in Asia related to the Covid-19 (coronavirus) pandemic as the continent struggles to conatin the outbreak.,https://www.thestar.com.my/news/regional/2020/03/30/covid-19-asia-latest-markets-fall-aussies-in-quarantine,World,health - epidemic and plague,100
Special Report: Five days of worship that set a virus time bomb in France,Thestar.com.my,30/3/2020,PARIS (Reuters) - From the stage of an evangelical superchurch; the leader of the gospel choir kicked off an evening of prayer and preaching: "We're going to celebrate the Lord! Are you feeling the joy tonight?",https://www.thestar.com.my/news/world/2020/03/30/special-report-five-days-of-worship-that-set-a-virus-time-bomb-in-france,World,religion and belief,100
Covid-19: Police site crashes as Kiwis turn into shutdown snitches,Thestar.com.my,30/3/2020,New Zealanders have become so keen to report their neighbours for breaking coronavirus lockdown rules that police on Monday said a website dedicated to addressing the issue crashed soon after going live.,https://www.thestar.com.my/tech/tech-news/2020/03/30/covid-19-police-site-crashes-as-kiwis-turn-into-shutdown-snitches,World,disaster and accident - transport accident - air and space accident,100
Oil plummets to 17-year low as broken market drowns in crude,Thestar.com.my,30/3/2020,OIL slumped to a 17-year low as coronavirus lockdowns cascaded through the world’s largest economies; leaving the market overwhelmed by cratering demand and a ballooning surplus of crude.,https://www.thestar.com.my/business/business-news/2020/03/30/oil-plummets-to-17-year-low-as-broken-market-drowns-in-crude,World,economy; business and finance - energy and resource - oil and gas (downstream activities),100
Netanyahu aide diagnosed with coronavirus; unclear if Israeli PM affected,Thestar.com.my,30/3/2020,JERUSALEM (Reuters) - An aide to Israeli Prime Minister Benjamin Netanyahu has tested positive for coronavirus; officials said on Monday; but it was not immediately clear if the 70-year-old leader had been exposed or his work affected.,https://www.thestar.com.my/news/world/2020/03/30/netanyahu-aide-diagnosed-with-coronavirus-unclear-if-israeli-pm-affected,World,politics - government - ministers (government),100
Labuan public housing residents need not pay rent for six months; says Annuar Musa,Thestar.com.my,30/3/2020,KUALA LUMPUR: Residents living in public housing owned by Labuan Corporation will not need to pay their rent for six months.,https://www.thestar.com.my/news/nation/2020/03/30/labuan-public-housing-residents-need-not-pay-rent-for-six-months-says-annuar-musa,World,politics - interior policy - housing and urban planning,100
India says no plan to extend coronavirus lockdown as poor struggle,Thestar.com.my,30/3/2020,NEW DELHI/BENGALURU (Reuters) - India has no plans to extend a 21-day lockdown to slow the spread of the coronavirus; the government said on Monday; as it struggled to keep essential supplies flowing and prevent tens of thousands of out-of-work people fleeing…,https://www.thestar.com.my/news/world/2020/03/30/india-says-no-plan-to-extend-coronavirus-lockdown-as-poor-struggle,World,,0
MMC is first private hospital in Negri Sembilan to provide drive-thru Covid-19 testing,Thestar.com.my,30/3/2020,SEREMBAN: The Mawar Medical Centre (MMC) here has become the first private hospital in Negri Sembilan to provide drive-thru Covid-19 testing to reduce the workload of government hospitals.,https://www.thestar.com.my/news/nation/2020/03/30/mmc-is-first-private-hospital-in-negri-sembilan-to-provide-drive-thru-covid-19-testing,World,health - hospital and clinic,100
Singapore eases Singdollar policy as economy braces for recession,Thestar.com.my,30/3/2020,SINGAPORE (The Straits Times/ANN): The Monetary Authority of Singapore (MAS) eased its policy stance on Monday (March 30) by setting the Singapore dollar's rate of appreciation at zero per cent at the prevailing lower level of its exchange rate policy band as…,https://www.thestar.com.my/news/regional/2020/03/30/singapore-eases-singdollar-policy-as-economy-braces-for-recession,Business,economy; business and finance - finance (general) - money and monetary policy,100
Ismail Sabri: Eateries; supermarkets to only operate from 8am to 8pm from April 1,Thestar.com.my,30/3/2020,PUTRAJAYA: Business hours for eateries and supermarkets will be more restricted during the second phase of the movement control order (MCO) which comes into effect on April 1.,https://www.thestar.com.my/news/nation/2020/03/30/ismail-sabri-eateries-supermarkets-to-only-operate-from-8am-to-8pm-from-april-1,World,,0
How a US$100bil South Korean insurer became a penny stock,Thestar.com.my,30/3/2020,INSURERS the world over have been walloped by evaporating investment returns; but those in South Korea have been hit particularly hard. Just consider this: The nation’s second-largest life insurer became a penny stock this month.,https://www.thestar.com.my/business/business-news/2020/03/30/how-a-us100bil-south-korean-insurer-became-a-penny-stock,Business,economy; business and finance - financial and business service - insurance,100
President Duterte to make public address on Covid-19 in Philippines today,Thestar.com.my,30/3/2020,MANILA; March 30 (The Philippine Inquirer/ANN) — President Rodrigo Duterte will address the public on Monday; two weeks since he placed the entire island of Luzon under quarantine to prevent the further spread of the coronavirus disease (Covid-19).,https://www.thestar.com.my/news/regional/2020/03/30/president-duterte-to-make-public-address-on-covid-19-in-philippines-today,World,,0
Thailand reports two new coronavirus deaths; bringing total to nine,Thestar.com.my,30/3/2020,BANGKOK (Reuters) - Thailand's public health ministry said on Monday that two more people have died from the new coronavirus; bringing the total number of deaths in the country to nine.,https://www.thestar.com.my/news/world/2020/03/30/thailand-reports-two-new-coronavirus-deaths-bringing-total-to-nine,World,health,100
Two Vietnam provinces want rice export ban lifted,Thestar.com.my,30/3/2020,,https://www.thestar.com.my/news/regional/2020/03/30/two-vietnam-provinces-want-rice-export-ban-lifted,World,,0
Mexico president visits 'El Chapo's' home turf; shakes hands with his mother,Thestar.com.my,30/3/2020,BADIRAGUATO; Mexico (Reuters) - Mexican President Andres Manuel Lopez Obrador on Sunday shook hands with the mother of the country's most infamous drug trafficker; Joaquin "El Chapo" Guzman; during a visit to their hometown; long a stronghold of the Sinaloa c…,https://www.thestar.com.my/news/world/2020/03/30/mexico-president-visits-039el-chapo039s039-home-turf-shakes-hands-with-his-mother,World,social issue - addiction,100
Private sector's finance; HR employees given one day to work on payroll process,Thestar.com.my,30/3/2020,KUALA LUMPUR (Bernama): The government has decided to allow employees of the finance or human resources division in the private sector to work for just one day to process payroll in accordance with the law.,https://www.thestar.com.my/news/nation/2020/03/30/private-sector039s-finance-hr-employees-given-one-day-to-work-on-payroll-process,Business,politics - government,100
Philippines grounds all Lionair planes after crash killing 8 people,Thestar.com.my,30/3/2020,MANILA; Philippines; March 30 (The Inquirer/ANN) — The Civil Aviation Authority of the Philippines (CAAP) has grounded the entire fleet of aircraft charter service company Lionair Inc. after one of its medical evacuation (Medevac) planes burst into flames dur…,https://www.thestar.com.my/news/regional/2020/03/30/philippines-grounds-all-lionair-planes-after-crash-killing-8-people,World,,0
IGP: Drones to be deployed in Sungai Lui to monitor residents during enhanced MCO,Thestar.com.my,30/3/2020,KAJANG: Drones will be used at the Sungai Lui areas in Hulu Langat; which has been put under the enhanced movement control order; says Inspector-General of Police Tan Sri Abdul Hamid Bador.,https://www.thestar.com.my/news/nation/2020/03/30/igp-drones-to-be-deployed-in-sungai-lui-to-monitor-residents-during-enhanced-mco,World,,0
