Title, Source, Date, Content, URL, Category, Classification, Relevance
Man eating at bus stop among 137 detained since the start of MCO in Melaka,Thestar.com.my,30/3/2020,MELAKA: A man who was enjoying his meal at a bus stop here is among those detained by Melaka police for violating the movement control order (MCO).,https://www.thestar.com.my/news/nation/2020/03/30/man-eating-at-bus-stop-among-137-detained-since-the-start-of-mco-in-melaka,World,crime; law and justice - police,100
Dutch coronavirus cases rise by 884 to 11;750 - authorities,Thestar.com.my,30/3/2020,AMSTERDAM (Reuters) - The number of confirmed coronavirus cases in the Netherlands rose to 11;750 on Monday from a day earlier; with 884 new cases and 93 new deaths; health authorities said.,https://www.thestar.com.my/news/world/2020/03/30/dutch-coronavirus-cases-rise-by-884-to-11750---authorities,World,social issue - demographics,100
Prominent Serbian Orthodox Church bishop dies of coronavirus,Thestar.com.my,30/3/2020,BELGRADE (Reuters) - A prominent bishop in the Serbian Orthodox Church died from a coronavirus infection less than a week after being hospitalised; his diocese said on Monday.,https://www.thestar.com.my/news/world/2020/03/30/prominent-serbian-orthodox-church-bishop-dies-of-coronavirus,World,religion and belief - christianity - orthodoxy,100
Zimbabweans enter coronavirus lockdown amid severe economic crisis,Thestar.com.my,30/3/2020,HARARE (Reuters) - Zimbabwe began a 21-day nationwide lockdown on Monday; following neighbour South Africa in implementing some of the world's toughest anti-coronavirus measures likely to hurt an economy already suffering hyperinflation and food shortages.,https://www.thestar.com.my/news/world/2020/03/30/zimbabweans-enter-coronavirus-lockdown-amid-severe-economic-crisis,Business,,0
What MCO? Four cabbies fined RM1k each for non-compliance in Sarawak,Thestar.com.my,30/3/2020,SIBU: Four taxi drivers were on Monday (March 30) fined RM1;000 each; in default two months' jail by the Magistrate's Court; after they pleaded guilty for not adhering to the movement control order (MCO).,https://www.thestar.com.my/news/nation/2020/03/30/what-mco-four-cabbies-fined-rm1k-each-for-non-compliance-in-sarawak,Business,crime; law and justice - judiciary (system of justice),100
Glezos; Greek who tore swastika from Acropolis in WW2; dies aged 97,Thestar.com.my,30/3/2020,ATHENS (Reuters) - Manolis Glezos; a prominent Greek whose act of defiance against Nazi occupation during World War Two was a rallying cry for the country's resistance movement; died on Monday; authorities said. He was 97.,https://www.thestar.com.my/news/world/2020/03/30/glezos-greek-who-tore-swastika-from-acropolis-in-ww2-dies-aged-97,World,unrest; conflicts and war - war,100
Fear on front lines as hospital staff face threats; stigma over coronavirus,Thestar.com.my,30/3/2020,MANILA: Janitor Ritchie Estabillo was on his way to work on Monday (March 30) when he was confronted by five men who poured bleach over his face; one of a growing number of hospital staff suffering abuse in the Philippines amid panic over Covid-19 (coronaviru…,https://www.thestar.com.my/news/regional/2020/03/30/fear-on-front-lines-as-hospital-staff-face-threats-stigma-over-coronavirus,World,,0
European solidarity is about more than shared bond issues - German government spokesman,Thestar.com.my,30/3/2020,BERLIN (Reuters) - European solidarity extends beyond the question of whether Germany backs the issue of common bonds to finance stimulus during the coronavirus crisis; German spokesman Steffen Seibert said on Monday.,https://www.thestar.com.my/news/world/2020/03/30/european-solidarity-is-about-more-than-shared-bond-issues---german-government-spokesman,Business,,0
Face mask rule could help when unwinding lockdown - German health ministry,Thestar.com.my,30/3/2020,BERLIN (Reuters) - An obligation for the general public to wear masks may have a role to play when Germany starts unwinding the lockdown measures that are currently in place to slow the spread of the coronavirus epidemic; a health ministry spokesman said.,https://www.thestar.com.my/news/world/2020/03/30/face-mask-rule-could-help-when-unwinding-lockdown---german-health-ministry,World,health - epidemic and plague,100
Germany: Coronavirus spreading too fast for us to loosen restrictions,Thestar.com.my,30/3/2020,BERLIN (Reuters) - Coronavirus is spreading too fast for restrictions on public life in Germany; Europe's economic powerhouse; to be lifted yet; a spokesman for the German government said on Monday.,https://www.thestar.com.my/news/world/2020/03/30/germany-coronavirus-spreading-too-fast-for-us-to-loosen-restrictions,Business,economy; business and finance - economy (general),100
Formula One team helps develop breathing aid for virus patients,Thestar.com.my,30/3/2020,LONDON/HONG KOMG: Medical researchers and engineers have teamed up with Formula One outfit Mercedes to adapt a breathing aid for mass production that could keep Covid-19 (coronavirus) outbreak patients off much-needed ventilators.,https://www.thestar.com.my/news/regional/2020/03/30/formula-one-team-helps-develop-breathing-aid-for-virus-patients,World,,0
Covid-19 death toll in Indonesia rises to 122; total cases to 1;414 (update),Thestar.com.my,30/3/2020,JAKARTA: The Indonesian government said on Monday (March 30) the death toll due to the Covid-19 (coronavirus) outbreak in the country climbed to 122; the highest in South-East Asia.,https://www.thestar.com.my/news/regional/2020/03/30/covid-19-death-toll-in-indonesia-rises-to-122-total-cases-to-1414-update,World,,0
Portuguese immigration officers arrested on suspicion of killing Ukrainian,Thestar.com.my,30/3/2020,LISBON (Reuters) - Portuguese police said on Monday they had detained three immigration officers on suspicion of killing a 40-year-old Ukrainian man who attempted to enter Portugal illegally through Lisbon's airport earlier this month.,https://www.thestar.com.my/news/world/2020/03/30/portuguese-immigration-officers-arrested-on-suspicion-of-killing-ukrainian,World,crime; law and justice - police,100
Fear on front lines as hospital staff face threats; stigma over coronavirus,Thestar.com.my,30/3/2020,MANILA (Reuters) - Janitor Ritchie Estabillo was on his way to work when he was confronted by five men who poured bleach over his face; one of a growing number of hospital staff suffering abuse in the Philippines amid panic over coronavirus infections.,https://www.thestar.com.my/news/world/2020/03/30/fear-on-front-lines-as-hospital-staff-face-threats-stigma-over-coronavirus,World,,0
Pahang MB: Another five initiatives for peoples' welfare announced,Thestar.com.my,30/3/2020,KUANTAN: The Pahang government has announced another five initiatives to protect the welfare of the people; on top of the previous eight initiatives unveiled earlier.,https://www.thestar.com.my/news/nation/2020/03/30/pahang-mb-another-five-initiatives-for-peoples039-welfare-announced,World,politics - government,100
Expo 2020 Dubai; the biggest showpiece; to be postponed by one year,Thestar.com.my,30/3/2020,DUBAI: Expo 2020 Dubai is set to be postponed by one year due to the global Covid-19 (coronavirus) pandemic; according to a draft statement seen by Reuters and two sources familiar with the matter on Monday (March 30).,https://www.thestar.com.my/news/regional/2020/03/30/expo-2020-dubai-the-biggest-showpiece-to-be-postponed-by-one-year,World,health - epidemic and plague,100
Gunmen kill New Zealand man at Freeport mine office in Indonesia's Papua,Thestar.com.my,30/3/2020,JAKARTA (Reuters) - Attackers shot dead a New Zealand man and wounded six other people at an office of the Indonesian arm of mining company Freeport-McMoRan Inc on Monday; police said.,https://www.thestar.com.my/news/world/2020/03/30/gunmen-kill-new-zealand-man-at-freeport-mine-office-in-indonesia039s-papua,World,disaster and accident,100
KL condo put under enhanced movement control order,Thestar.com.my,30/3/2020,PETALING JAYA: The Menara City One condominium tower in Jalan Munshi Abdullah; Kuala Lumpur; has been placed under an enhanced movement control order (MCO).,https://www.thestar.com.my/news/nation/2020/03/30/kl-condo-put-under-enhanced-movement-control-order,World,,0
Cops detain five men in Perak for violating MCO; seize 17 bottles of ketum water,Thestar.com.my,30/3/2020,IPOH: Five men were detained by the police for violating the movement control order (MCO) at Kampung Gajah.,https://www.thestar.com.my/news/nation/2020/03/30/cops-detain-five-men-in-perak-for-violating-mco-seize-17-bottles-of-ketum-water,World,crime; law and justice - police,100
China envoy presents 20;000 face masks to Home Minister,Thestar.com.my,30/3/2020,PUTRAJAYA: A total of 20;000 face masks from China were presented to the Home Ministry here for its frontliners in their fight against Covid-19.,https://www.thestar.com.my/news/nation/2020/03/30/china-envoy-presents-20000-face-masks-to-home-minister,World,,0
American stay-at-home order needed to prevent coronavirus spread - Fauci,Thestar.com.my,30/3/2020,WASHINGTON (Reuters) - Americans need to press on with efforts to contain the spread of coronavirus to start seeing the rates of infection come down; a top U.S. health official said on Monday after President Donald Trump extended a stay-at-home order through …,https://www.thestar.com.my/news/world/2020/03/30/american-stay-at-home-order-needed-to-prevent-coronavirus-spread---fauci,World,health - disease - virus diseases,100
Japan; IOC set July 23 next year for start of delayed Olympics,Thestar.com.my,30/3/2020,TOKYO: Japanese organisers and the International Olympic Committee (IOC) decided on Monday (March 30) that the Tokyo Olympic Games would start on July 23;2021; and run until Aug 8; Kyodo news reported.,https://www.thestar.com.my/news/regional/2020/03/30/japan-ioc-set-july-23-next-year-for-start-of-delayed-olympics,World,sport - sports event - World games,100
Nearly 12;300 Spanish health workers have coronavirus,Thestar.com.my,30/3/2020,MADRID (Reuters) - Some 12;298 health workers have tested positive for coronavirus in Spain; deputy health emergency chief Maria Jose Sierra said at a news conference on Monday.,https://www.thestar.com.my/news/world/2020/03/30/nearly-12300-spanish-health-workers-have-coronavirus,World,,0
Ukraine dusts off Soviet-era ventilator designs to help fight coronavirus,Thestar.com.my,30/3/2020,KIEV (Reuters) - Ukraine is dusting off Soviet-era ventilator designs that lay forgotten in a mothballed military factory for years in a bid to ramp up domestic production of equipment that could help in the fight against the coronavirus.,https://www.thestar.com.my/news/world/2020/03/30/ukraine-dusts-off-soviet-era-ventilator-designs-to-help-fight-coronavirus,World,,0
'This is bliss': Chinese barber has clients queuing up as Wuhan eases lockdown,Thestar.com.my,30/3/2020,WUHAN; China (Reuters) - For barber Xiong Juan; a recent easing of restrictions in the city of Wuhan; epicentre of China's coronavirus outbreak; means she is now busier than ever.,https://www.thestar.com.my/news/world/2020/03/30/039this-is-bliss039-chinese-barber-has-clients-queuing-up-as-wuhan-eases-lockdown,World,,0
Philippines plans 300;000 tons rice import amid lockdown,Thestar.com.my,30/3/2020,MANILA: The Philippines plans to import 300;000 metric tons of rice through state deals to boost supply amid the month-long lockdown due to the Covid-19 (coronavirus) outbreak; Cabinet Secretary Karlo Nograles said on Monday (March 30).,https://www.thestar.com.my/news/regional/2020/03/30/philippines-plans-300000-tons-rice-import-amid-lockdown,World,,0
Cities worldwide have cleaner air amid lockdowns; satellite maps show,Thestar.com.my,30/3/2020,HONG KONG: Air pollution has fallen in cities across the planet; satellite imaging analysed by the European Public Health Alliance (EPHA) shows; as Covid-19 (coronavirus) travel restrictions ground planes and keep cars off the streets.,https://www.thestar.com.my/news/regional/2020/03/30/cities-worldwide-have-cleaner-air-amid-lockdowns-satellite-maps-show,World,environmental issue - environmental pollution,100
Chinese customs toughens measures to curb Covid-19 import,Thestar.com.my,30/3/2020,BEIJING: China has ramped up measures to stem the inflow of Covid (coronavirus) disease cases; the General Administration of Customs (GAC) said Monday (March 30).,https://www.thestar.com.my/news/regional/2020/03/30/chinese-customs-toughens-measures-to-curb-covid-19-import,World,,0
Swiss coronavirus death toll nears 300; positive tests approach 15;500,Thestar.com.my,30/3/2020,ZURICH (Reuters) - The Swiss death toll from coronavirus has reached 295 people; the country's public health bureau said on Monday; rising from 257 people on Sunday.,https://www.thestar.com.my/news/world/2020/03/30/swiss-coronavirus-death-toll-nears-300-positive-tests-approach-15500,World,,0
Air strikes hit Houthi-held Yemeni capital Sanaa - witnesses,Thestar.com.my,30/3/2020,DUBAI (Reuters) - The Saudi-led coalition fighting the Houthi group in Yemen  carried out several air strikes on Monday on the capital Sanaa; where bombings have been rare in recent months thanks to U.N.-backed de-escalation efforts; witnesses said.,https://www.thestar.com.my/news/world/2020/03/30/air-strikes-hit-houthi-held-yemeni-capital-sanaa---witnesses,World,labour - strike,100
Indian police fire tear gas on jobless workers defying coronavirus lockdown,Thestar.com.my,30/3/2020,NEW DELHI/AHMEDABAD: Police in western India fired tear gas to disperse a stone-pelting crowd of migrant workers defying a three-week lockdown against the coronavirus that has left hundreds of thousands of poor without jobs and hungry; authorities said on Mon…,https://www.thestar.com.my/news/regional/2020/03/30/indian-police-fire-tear-gas-on-jobless-workers-defying-coronavirus-lockdown,World,social issue - poverty,100
Legal firms affected by MCO; says Malaysian Bar,Thestar.com.my,30/3/2020,KUALA LUMPUR: The Malaysian Bar is urging the government to provide more relief for law firms affected by the movement control order (MCO) as there were "insufficient provisions" for the firms in the recently announced stimulus package.,https://www.thestar.com.my/news/nation/2020/03/30/legal-firms-affected-by-mco-says-malaysian-bar,World,politics - government,100
Drop in China's new coronavirus cases; none in Wuhan for sixth day,Thestar.com.my,30/3/2020,WUHAN: China on Monday reported a drop in new Covid-19 (coronavirus) infections for a fourth day as drastic curbs on international travellers reined in the number of imported cases; while policymakers turned their efforts to healing the world's second-largest…,https://www.thestar.com.my/news/regional/2020/03/30/drop-in-china039s-new-coronavirus-cases-none-in-wuhan-for-sixth-day,World,health - disease - virus diseases,100
Prime Minister's Office: Economic Action Council welcomes two new members from Sabah and Sarawak,Thestar.com.my,30/3/2020,PETALING JAYA: The Economic Action Council (EAC) has agreed to appoint two top industry players from Sabah and Sarawak as members to represent the states; says the Prime Minister’s Office (PMO).,https://www.thestar.com.my/news/nation/2020/03/30/prime-minister039s-office-economic-action-council-welcomes-two-new-members-from-sabah-and-sarawak,World,,0
Spain's health emergency chief Fernando Simon has coronavirus - official,Thestar.com.my,30/3/2020,MADRID (Reuters) - Spain's health emergency chief Fernando Simon; who leads the country's response to the coronavirus epidemic and maintains regular contact with Prime Minister Pedro Sanchez; has tested positive for the virus; health official Maria Jose Sierr…,https://www.thestar.com.my/news/world/2020/03/30/spain039s-health-emergency-chief-fernando-simon-has-coronavirus---official,World,health - epidemic and plague,100
'The watermelons will rot:' U.S. visa confusion in Mexico keeps out agriculture workers,Thestar.com.my,30/3/2020,MONTERREY/CHICAGO (Reuters) - It’s watermelon season in Florida. But as the top U.S. watermelon-producing state prepares for harvest; many of the workers needed to collect the crop are stuck in Mexico; unable to secure visas.,https://www.thestar.com.my/news/world/2020/03/30/039the-watermelons-will-rot039-us-visa-confusion-in-mexico-keeps-out-agriculture-workers,World,labour - employment,100
S. Korea provides US$10mil to Cambodia for school feeding programme,Thestar.com.my,30/3/2020,PHNOM PENH: The Korea International Cooperation Agency (KOICA) on Monday (March 30) provided grant aid of US$10mil to Cambodia for implementing and expanding the Home-Grown School Feeding Programmr; said a World Food Programme Cambodia (WFP)'s press statement.,https://www.thestar.com.my/news/regional/2020/03/30/s-korea-provides-us10mil-to-cambodia-for-school-feeding-programme,Business,human interest,100
Renault: China; South Korea plants restarting after virus shutdown,Thestar.com.my,30/3/2020,BEIJING/PARIS: French automaker Renault said on Monday (March 30) it was resuming production at two factories in China and South Korea after they were shut down as authorities tried to limit the Covid-19 (coronavirus) outbreak.,https://www.thestar.com.my/news/regional/2020/03/30/renault-china-south-korea-plants-restarting-after-virus-shutdown,World,economy; business and finance - manufacturing and engineering - automotive equipment,100
Aset Kayamas support for frontliners to combat pandemic,Thestar.com.my,30/3/2020,KUALA LUMPUR: Aset Kayamas Sdn Bhd has contributed 6;000 sets of medical-grade protective suits to frontliners who are fighting tirelessly against the Covid-19 pandemic.,https://www.thestar.com.my/news/nation/2020/03/30/aset-kayamas-support-for-frontliners-to-combat-pandemic,World,health - epidemic and plague,100
MCO: Govt to continue engaging with stakeholders to address economic fallout; says Dr Wee,Thestar.com.my,30/3/2020,PETALING JAYA: In an effort to address the Covid-19 economic fallout; Transport Minister Datuk Seri Dr Wee Ka Siong says the government will continue engaging with stakeholders to identify their concerns during the movement control order (MCO).,https://www.thestar.com.my/news/nation/2020/03/30/mco-govt-to-continue-engaging-with-stakeholders-to-address-economic-fallout-says-dr-wee,Business,,0
North Korea: US will not drop hostile policy despite leaders' "special relationship",Thestar.com.my,30/3/2020,SEOUL: North Korea said the United States will not drop its hostile policy even though their two leaders have a "special relationship"; state media KCNA said on Monday (March 30). A North Korean official said in the statement US Secretary of State Mike Pompeo…,https://www.thestar.com.my/news/regional/2020/03/30/north-korea-us-will-not-drop-hostile-policy-despite-leaders039-special-relationship,World,,0
Penor Prison inmates pitch in to make PPE for medical frontliners,Thestar.com.my,30/3/2020,KUANTAN (Bernama): The Penor Prison sewing workshop here is racing against time to produce personal protecting equipment (PPE) for medical personnel treating Covid-19 patients.,https://www.thestar.com.my/news/nation/2020/03/30/penor-prison-inmates-pitch-in-to-make-ppe-for-medical-frontliners,World,crime; law and justice - prison,100
Syed Saddiq: Yes; RM250;000 is missing from my safe; but it isn't Bersatu's,Thestar.com.my,30/3/2020,PETALING JAYA: Former youth and sports minister Syed Saddiq Syed Abdul Rahman has denied that the RM250;000 missing from a safe in his Petaling Jaya home belonged to Parti Pribumi Bersatu Malaysia (Bersatu).,https://www.thestar.com.my/news/nation/2020/03/30/syed-saddiq-yes-rm250000-is-missing-from-my-safe-but-it-isn039t-bersatu039s,World,,0
Iran's coronavirus death toll reaches 2;757 - health official,Thestar.com.my,30/3/2020,DUBAI (Reuters) - Iran's death toll from the new coronavirus has increased to 2;757 with 117 new deaths in the past 24 hours; a health ministry spokesman told state TV on Monday; adding that the total number of cases has climbed to 41;495.,https://www.thestar.com.my/news/world/2020/03/30/iran039s-coronavirus-death-toll-reaches-2757---health-official,World,health,100
Austria to make basic face masks compulsory in supermarkets,Thestar.com.my,30/3/2020,VIENNA (Reuters) - Austria will require the public to wear basic face masks in supermarkets; where they will be handed out probably from Wednesday in a bid to slow the spread of the coronavirus; Chancellor Sebastian Kurz said on Monday.,https://www.thestar.com.my/news/world/2020/03/30/austria-to-make-basic-face-masks-compulsory-in-supermarkets,World,,0
North Korea says U.S. will not drop hostile policy despite leaders' good relationship - KCNA,Thestar.com.my,30/3/2020,SEOUL (Reuters) - North Korea said the United States will not drop its hostile policy; even though their two leaders have a good relationship; state media KCNA said on Monday.,https://www.thestar.com.my/news/world/2020/03/30/north-korea-says-us-will-not-drop-hostile-policy-despite-leaders039-good-relationship---kcna,World,,0
Japan is 'not planning' a coronavirus emergency but entry bans loom,Thestar.com.my,30/3/2020,TOKYO (Reuters) - Japan has no plan to declare a state of emergency from April; its top government spokesman said on Monday; seeking to dispel mounting fears a recent spike in coronavirus cases could lead to a first-ever lockdown of the capital; Tokyo.,https://www.thestar.com.my/news/world/2020/03/30/japan-is-039not-planning039-a-coronavirus-emergency-but-entry-bans-loom,World,,0
Top Japanese doctor calls on PM Abe to declare coronavirus emergency,Thestar.com.my,30/3/2020,TOKYO (Reuters) - A top Japanese doctor on Monday called on Prime Minister Shinzo Abe to issue an emergency decree to fight the coronavirus before it was too late.,https://www.thestar.com.my/news/world/2020/03/30/top-japanese-doctor-calls-on-pm-abe-to-declare-coronavirus-emergency,World,,0
MCO: Bleak future for privately-owned zoological parks; says Mazpa,Thestar.com.my,30/3/2020,MELAKA: The Malaysian Association of Zoological Parks and Aquaria (Mazpa) is appealing to the government to provide them with financial assistance to save jobs and wildlife at privately-managed menageries.,https://www.thestar.com.my/news/nation/2020/03/30/mco-bleak-future-of-privately-owned-zoological-parks-says-mazpa,World,environmental issue - natural resources - wildlife,100
Police arrest 13 people in Petaling Jaya between Sunday and Monday for violating MCO,Thestar.com.my,30/3/2020,PETALING JAYA: The police have arrested 13 people here  on Sunday (March 29) and Monday (March 30) for violating the movement control order (MCO).,https://www.thestar.com.my/news/nation/2020/03/30/police-arrest-13-people-in-petaling-jaya-between-sunday-and-monday-for-violating-mco,World,crime; law and justice - police - arrest,100
Asian markets mostly down as Covid-19 fears grow,Thestar.com.my,30/3/2020,HoONG KONG: Asian markets fell on Monday (March 30) following a steep drop on Wall Street as the jubilation from last week's enormous US stimulus package faded and investors returned their attention to the soaring infection and death rate of the coronavirus.,https://www.thestar.com.my/news/regional/2020/03/30/asian-markets-mostly-down-as-covid-19-fears-grow,World,health - disease - virus diseases,100
AFP: Global declared coronavirus cases top 700;000,Thestar.com.my,30/3/2020,BEIJING/PARIS/TOKYO: More than 700;000 cases of the novel coronavirus have been officially declared around the world since the start of the pandemic; according to an AFP tally as of 5pm on Monday (March 30) based on official sources.,https://www.thestar.com.my/news/regional/2020/03/30/afp-global-declared-coronavirus-cases-top-700000,World,health - epidemic and plague,100
Alliance Bank employee tests positive for Covid-19,Thestar.com.my,30/3/2020,PETALING JAYA: Alliance Bank has confirmed that an employee at its Damansara Uptown branch has tested positive for Covid-19.,https://www.thestar.com.my/news/nation/2020/03/30/alliance-bank-employee-tests-positive-for-covid-19,World,economy; business and finance - financial and business service - banking,100
Sarawak records two more Covid-19 deaths,Thestar.com.my,30/3/2020,KUCHING: Sarawak recorded two more deaths from Covid-19 on Monday (March 30); bringing the number of fatalities in the state to seven.,https://www.thestar.com.my/news/nation/2020/03/30/sarawak-records-two-more-covid-19-deaths,World,social issue - demographics,100
Singapore court rejects challenge to gay sex ban,Thestar.com.my,30/3/2020,SiINGAPORE: A fresh bid to overturn a Singapore law banning gay sex failed on Monday (March 30) as a court dismissed several challenges; a setback for efforts to promote greater LGBT rights in South-East Asian region and also Asia in the greater picture.,https://www.thestar.com.my/news/regional/2020/03/30/singapore-court-rejects-challenge-to-gay-sex-ban,Singapore,crime; law and justice - justice and rights,100
Sabah cops arrest 40; including sepak takraw players; for violating MCO,Thestar.com.my,30/3/2020,KOTA KINABALU: Nine youths playing sepak takraw and a farmer at a cockfighting session were among 40 people arrested so far for allegedly violating the movement control order (MCO) in Sabah.,https://www.thestar.com.my/news/nation/2020/03/30/sabah-cops-arrest-40-including-sepak-takraw-players-for-violating-mco,World,sport - sepak takraw,100
China slashes rate; pumps US$7bil into market to counter virus,Thestar.com.my,30/3/2020,BEIJING: China's central bank on Monday (March 30) cut an interest rate on loans to banks by the largest margin in five years and injected 50 billion yuan (US$7bil) into the financial system to help the world's second-largest economy weather the (Covid-19) co…,https://www.thestar.com.my/news/regional/2020/03/30/china-slashes-rate-pumps-us7bil-into-market-to-counter-virus,Business,economy; business and finance - macro economics - interest rate,100
