Title, Source, Date, Content, URL, Category
With 660;000 job losses; rich Nordic economies are in deep shock,Straitstimes.com,30/3/2020,STOCKHOLM (BLOOMBERG) - In one of the richest and stablest corners of the globe; well over half a million people are suddenly out of a job due to the economic standstill triggered by the spread of the coronavirus.. Read more at straitstimes.com.,https://www.straitstimes.com/business/economy/with-660000-job-losses-rich-nordic-economies-are-in-deep-shock,Business
MAS eases Singdollar policy in major move as economy braces for recession - The Straits Times,Straitstimes.com,30/3/2020,It has set the Singapore dollar's rate of appreciation at zero per cent at the prevailing lower level of its policy band.. Read more at straitstimes.com.,https://www.straitstimes.com/business/economy/mas-sets-zero-appreciation-path-for-singdollar-at-lower-level-in-easing-move,Business
Tech firms urged to do more to curb fake news on coronavirus - The Straits Times,Straitstimes.com,29/3/2020,NEW YORK • The biggest reputational risk Facebook and other social media firms had expected this year was fake news surrounding the United States presidential election. The misinformation threat seemed familiar; even manageable.. Read more at straitstimes.com.,https://www.straitstimes.com/world/united-states/tech-firms-urged-to-do-more-to-curb-fake-news-on-coronavirus,World
70 new coronavirus patients in Singapore; of which 41 are imported cases,Straitstimes.com,28/3/2020,70 new coronavirus patients in Singapore; of which 41 are imported cases straitstimes.com,https://www.straitstimes.com/singapore/health/70-new-coronavirus-patients-in-singapore-of-which-41-are-imported-cases,Singapore
Coronavirus: Two police officers test positive for Covid-19; police giving support to next-of-kin,Straitstimes.com,28/3/2020,SINGAPORE - The Singapore Police Force said on Saturday (March 28) that two of its officers have tested positive for Covid-19.. Read more at straitstimes.com.,https://www.straitstimes.com/singapore/health/coronavirus-two-police-officers-test-positive-for-covid-19-police-giving-support-to,Singapore
I can't smell the orange: NUS don tested positive for Covid-19 after losing sense of smell,Straitstimes.com,28/3/2020,I can't smell the orange: NUS don tested positive for Covid-19 after losing sense of smell straitstimes.com,https://www.straitstimes.com/singapore/health/coronavirus-i-feel-extremely-lucky-to-be-here-says-pr-with-covid-19-in-sgh,Singapore
Coronavirus: Long-term and student pass holders to require approval to enter Singapore - The Straits Times,Straitstimes.com,28/3/2020,Those arriving in Singapore without the approval letter of entry will not be allowed to clear immigration and will be required to fly out of Singapore within 48 hours at their own cost.  . Read more at straitstimes.com.,https://www.straitstimes.com/singapore/coronavirus-long-term-pass-holders-and-students-pass-holder-to-require-approval-to-enter,Singapore
Crowd-limiting measures at malls; public venues as new safe distancing rules kick in - straits times,Straitstimes.com,27/3/2020,Most malls sealed the majority of their entrances; including underpasses to MRT stations and other buildings; to control traffic flow.. Read more at straitstimes.com.,https://www.straitstimes.com/singapore/crowd-limiting-measures-at-malls-public-venues-as-new-rules-kick-in,Singapore
Coronavirus: Don't forget to stay cyber-safe while telecommuting - The Straits Times,Straitstimes.com,27/3/2020,SINGAPORE - Mute the microphone and cover up the webcam after a teleconference; and lock the computer screen if you are walking away to take a break. These are among the measures recommended by SingCERT (Singapore Computer Emergency Response Team) to stay cyb…,https://www.straitstimes.com/singapore/coronavirus-dont-forget-to-stay-cyber-safe-while-telecommuting,Singapore
Video of Indonesian family unwrapping body of suspected coronavirus fatality goes viral - The Straits Times,Straitstimes.com,27/3/2020,JAKARTA (THE JAKARTA POST/ASIA NEWS NETWORK) - A video showing a family uncovering the shroud of a deceased woman suspected to have been coronavirus-positive in Kolaka regency; Southeast Sulawesi; went viral over social media.. Read more at straitstimes.com.,https://www.straitstimes.com/asia/se-asia/viral-video-shows-indonesian-family-unwrapping-body-of-suspected-coronavirus-fatality,World
Coronavirus: Staff at PCF cluster were at work while sick; experts urge people to stay home unless 100% well,Straitstimes.com,26/3/2020,SINGAPORE - Infectious disease experts here are urging people to stay home unless they are "100 per cent" well; following news that staff in the coronavirus cluster at PCF Sparkletots Fengshan were at work while sick.. Read more at straitstimes.com.,https://www.straitstimes.com/singapore/health/coronavirus-staff-at-pcf-cluster-were-at-work-while-sick-experts-urge-people-to,Singapore
Billionaires want people back to work; but employees not so sure...,Straitstimes.com,25/3/2020,Billionaires want people back to work; but employees not so sure... (Top headline; 16th story; link ) Related stories: First US child to die from virus diagnosed after death; 'didn't meet test criteria'... Bailout prevents Trump and family from personally ben…,https://www.straitstimes.com/world/united-states/coronavirus-billionaires-want-people-back-to-work-but-their-employees-arent-so,World
All PCF centres to close for 4 days after coronavirus cluster reported at Fengshan Sparkletots pre-school,Straitstimes.com,25/3/2020,SINGAPORE - All 360 centres under PAP Community Foundation (PCF) will close for four days from Thursday (March 26) after 18 Covid-19 cases were found to be linked to its pre-school in Bedok North.. Read more at straitstimes.com.,https://www.straitstimes.com/singapore/health/all-pcf-centres-to-close-for-4-days-after-coronavirus-cluster-reported-at-fengshan,Singapore
Coronavirus: MOM will not extend temporary housing support to Malaysian workers,Straitstimes.com,25/3/2020,SINGAPORE - The Ministry of Manpower (MOM) is urging employers to find longer term accommodation for their Malaysian workers employed in Singapore given that the government will not extend temporary housing support beyond March 31.. Read more at straitstimes.…,https://www.straitstimes.com/singapore/health/coronavirus-mom-will-not-extend-temporary-housing-support-to-malaysian-workers,Singapore
Singapore sends coronavirus test kits to Brunei,Straitstimes.com,25/3/2020,SINGAPORE - The Republic has sent medical supplies to Brunei that will allow doctors there to detect and help contain the coronavirus outbreak.. Read more at straitstimes.com.,https://www.straitstimes.com/singapore/health/singapore-sends-coronavirus-test-kits-to-brunei,Singapore
Presence of a virus on surface does not necessarily mean it is infectious: Experts - The Straits Times,Straitstimes.com,25/3/2020,SINGAPORE - A virus may be detectable on a surface days after a patient leaves behind traces; but this does not necessarily mean it is still infectious; experts say.. Read more at straitstimes.com.,https://www.straitstimes.com/singapore/health/presence-of-a-virus-on-surface-does-not-necessarily-mean-it-is-infectious-experts,Singapore
Singapore working with 6 other countries to maintain supply of essential goods,Straitstimes.com,25/3/2020,The countries - including Australia; Canada; Chile; New Zealand; Myanmar and Brunei - said they will ensure that trade lines remain open.. Read more at straitstimes.com.,https://www.straitstimes.com/business/economy/singapore-working-with-6-other-countries-to-maintain-supply-of-essential-goods,Business
Coronavirus: Singapore scientists on the front lines of fight against Covid-19,Straitstimes.com,24/3/2020,Professor Jackie Ying; who heads the NanoBio Lab at the Agency for Science; Technology and Research (A*Star); and her team have come up with a rapid test that can tell if a person has Covid-19 in as little as five minutes. When approved; this would be about t…,https://www.straitstimes.com/singapore/health/singapore-scientists-on-the-front-lines-of-fight-against-covid-19,Singapore
49 new coronavirus cases in Singapore; of which 32 are from overseas,Straitstimes.com,24/3/2020,SINGAPORE - The Republic has confirmed 49 new coronavirus cases on Tuesday (March 24); as students and workers continued to return home in droves from abroad.. Read more at straitstimes.com.,https://www.straitstimes.com/singapore/health/49-new-coronavirus-cases-in-singapore-of-which-32-are-from-overseas,Singapore
Coronavirus: All entertainment venues in Singapore to close; gatherings outside work and school limited to 10 people,Straitstimes.com,24/3/2020,Bars; cinemas and all other entertainment outlets will be closed from March 26; 11.59pm till April 30.. Read more at straitstimes.com.,https://www.straitstimes.com/singapore/health/all-entertainment-venues-in-singapore-to-close-gatherings-outside-work-and-school,Singapore
Coronavirus: 3 parents of Singapore American School students test positive; international schools switch to remote learning,Straitstimes.com,24/3/2020,The school's superintendent said that all three parents are in good condition in the hospital; and that none of them had visited the school.. Read more at straitstimes.com.,https://www.straitstimes.com/singapore/health/coronavirus-three-parents-of-singapore-american-school-studentstest-positive,Singapore
BreadTalk cuts staff salaries amid coronavirus outbreak,Straitstimes.com,24/3/2020,SINGAPORE (THE BUSINESS TIMES) - BreadTalk Group is cutting between 10 per cent and 50 per cent of salaries temporarily as part of a cost-saving exercise amid the coronavirus outbreak; the company said on Monday (March 23).. Read more at straitstimes.com.,https://www.straitstimes.com/business/companies-markets/breadtalk-cuts-staff-salaries-amid-coronavirus-outbreak,Business
Recovering coronavirus patients sent to Mt Elizabeth Hospital; freeing beds in public hospitals for sicker patients,Straitstimes.com,23/3/2020,Recovering coronavirus patients sent to Mt Elizabeth Hospital; freeing beds in public hospitals for sicker patients straitstimes.com,https://www.straitstimes.com/singapore/health/recovering-covid-19-patients-sent-to-mt-elizabeth-hospital-freeing-beds-in-public,Singapore
Asia stocks crumble as more nations shut for business to curb coronavirus; STI dives 8.4% - The Straits Times,Straitstimes.com,23/3/2020,SYDNEY (REUTERS; BLOOMBERG) - Asian shares sank on Monday (March 23) as more countries all but shut down in the fight against the coronavirus pandemic; threatening to overwhelm policymakers’ frantic efforts to cushion what is clear to be a deep global recessi…,https://www.straitstimes.com/business/companies-markets/us-futures-plunge-to-volatility-limit-on-recession-fears-over-coronavirus,Business
S'pore residents who still go abroad may face consequences - The Straits Times,Straitstimes.com,22/3/2020,Those who choose to travel abroad despite travel advisories against doing so may face consequences; National Development Minister Lawrence Wong said yesterday.. Read more at straitstimes.com.,https://www.straitstimes.com/singapore/health/spore-residents-who-still-go-abroad-may-face-consequences,Singapore
Growing an ecosystem of good; Business News & Top Stories - The Straits Times,Straitstimes.com,22/3/2020,How Company of Good empowered Abry’s founder and CEO to collaborate with others to create a greater impact to help marginalised individuals and their families. Read more at straitstimes.com.,https://www.straitstimes.com/business/growing-an-ecosystem-of-good,Business
Coronavirus: 23 new cases in Singapore including 18 imported; 4 recovered,Straitstimes.com,22/3/2020,Of the five locally transmitted cases; three are linked to previous cases. One of them; Case 443; is linked to the Boulder+ climbing gym cluster which now has six cases linked to it in total.. Read more at straitstimes.com.,https://www.straitstimes.com/singapore/health/coronavirus-23-new-cases-in-singapore-including-18-imported-4-recovered,Singapore
Lockdowns not enough to defeat coronavirus; says leading World Health Organisation expert - The Straits Times,Straitstimes.com,22/3/2020,Lockdowns not enough to defeat coronavirus; says leading World Health Organisation expert The Straits Times WHOs emergency expert says lockdown not enough to combat COVID-19 - Republic World Republic World Lockdowns Not Enough To Defeat Coronavirus; Says WHO …,https://www.straitstimes.com/world/lockdowns-not-enough-to-defeat-coronavirus-says-leading-world-health-organisation-expert,World
Singapore businesses seek larger second stimulus package urgently as global economy worsens - The Straits Times,Straitstimes.com,22/3/2020,SINGAPORE - Businesses here are hoping for more support from the Government in the form of a larger second stimulus package as the global economy worsens amid the Covid-19 outbreak.. Read more at straitstimes.com.,https://www.straitstimes.com/singapore/singapore-businesses-seek-larger-second-stimulus-package-urgently-as-global-economy,Singapore
Coronavirus: Singaporean residents who travel overseas may face consequences as Govt ramps up border controls,Straitstimes.com,22/3/2020,Those who choose to travel abroad despite travel advisories may face consequences in the near future; said the Government on Sunday (March 22).. Read more at straitstimes.com.,https://www.straitstimes.com/singapore/health/coronavirus-those-who-travel-overseas-for-holiday-may-face-consequences-as-govt,Singapore
Coronavirus: All short-term visitors barred from entering and transiting in Singapore from Monday; 11.59pm,Straitstimes.com,22/3/2020,Work pass holders and their dependents will be allowed to return to Singapore only if they work in sectors that provide essential services such as healthcare and transport.. Read more at straitstimes.com.,https://www.straitstimes.com/singapore/health/coronavirus-all-short-term-visitors-barred-from-entering-and-transiting-in,Singapore
Coronavirus: 47 new cases in Singapore; including 39 imported,Straitstimes.com,21/3/2020,This was the same figure as the number of cases reported on March 18; the highest number since the start of the outbreak.. Read more at straitstimes.com.,https://www.straitstimes.com/singapore/health/coronavirus-47-new-cases-in-singapore-including-39-imported,Singapore
Coronavirus: MOH advises doctors in Singapore to stop or defer accepting non-resident foreign patients - The Straits Times,Straitstimes.com,21/3/2020,SINGAPORE - All doctors in public and private hospitals; as well as private specialist clinics; have been advised by the Ministry of Health (MOH) to immediately stop or defer accepting new foreign patients who do not reside in Singapore.. Read more at straits…,https://www.straitstimes.com/singapore/coronavirus-moh-advises-doctors-in-singapore-to-stop-or-defer-accepting-non-resident,Singapore
Coronavirus: I didn't know I brought home more than just business cards from London; says Singapore technopreneur - The Straits Times,Straitstimes.com,21/3/2020,SINGAPORE - When Singaporean Simon Gwozdz attended a conference in London earlier this month; he did not expect to bring home more than just business cards.. Read more at straitstimes.com.,https://www.straitstimes.com/singapore/i-didnt-know-i-brought-home-more-than-just-business-cards-after-london-conference-says,Singapore
Singapore reports first two Covid-19 deaths: Health Minister Gan Kim Yong,Straitstimes.com,21/3/2020,SINGAPORE - Two patients died from Covid-19 on Saturday morning (March 21) due to complications; the first deaths the Republic has seen.. Read more at straitstimes.com.,https://www.straitstimes.com/singapore/singapore-reports-two-covid-19-deaths-health-minister-gan,Singapore
How China; S. Korea and Taiwan are using tech to curb outbreak - The Straits Times,Straitstimes.com,20/3/2020,Various apps have been created in China; South Korea and Taiwan to exploit smartphone technologies for everything from contact tracing to enforcing quarantines that require people who have been exposed to the coronavirus to stay at home.. Read more at straits…,https://www.straitstimes.com/asia/east-asia/how-china-s-korea-and-taiwan-are-using-tech-to-curb-outbreak,World
Coronavirus: PM Lee Hsien Loong live telecast on Friday night is fake news; says Govt spokesman - The Straits Times,Straitstimes.com,20/3/2020,SINGAPORE - Prime Minister Lee Hsien Loong will not address the nation on Friday night (March 20); contrary to messages circulating online that he will do so in a live telecast at 8pm.. Read more at straitstimes.com.,https://www.straitstimes.com/singapore/coronavirus-pm-lee-hsien-loong-live-telecast-on-friday-night-is-fake-news-says-govt,Singapore
Coronavirus: Cinemas here stay open; turn to new ways to sustain business - straits times,Straitstimes.com,20/3/2020,SINGAPORE (THE NEW PAPER) - Movie theatres worldwide are being shut down; but the show is going on for local cinema chains.. Read more at straitstimes.com.,https://www.straitstimes.com/singapore/health/coronavirus-cinemas-here-stay-open-turn-to-new-ways-to-sustain-business,Singapore
South Korea throws up innovative tech solutions in coronavirus fight - The Straits Times,Straitstimes.com,19/3/2020,SEOUL - A drive-through test for the coronavirus. A body steriliser installed at entrances to spray disinfectants on people walking through. A mobile app to keep track of the health status of overseas visitors.. Read more at straitstimes.com.,https://www.straitstimes.com/asia/east-asia/south-korea-throws-up-innovative-tech-solutions-in-coronavirus-fight,World
Staff 'worked while symptomatic' at US care home with 35 virus deaths - The Straits Times,Straitstimes.com,19/3/2020,LOS ANGELES (AFP) - The devastating coronavirus outbreak at a nursing home near Seattle where 35 have died was likely fuelled by infected staff members continuing to come to work; a report found on Wednesday (March 18).. Read more at straitstimes.com.,https://www.straitstimes.com/world/united-states/staff-worked-while-symptomatic-at-us-care-home-with-35-virus-deaths,World
Supercharge your career prospects with e-commerce and cyber security courses from The University of Hong Kong - straits times,Straitstimes.com,18/3/2020,From chatbots to interactive product visualisation; e-commerce has taken the retail world by storm and redefined shopping for millions of shoppers worldwide. According to global research firm Statista; online retail sales amounted to US$3.53 trillion (S$4.8 t…,https://www.straitstimes.com/singapore/education/supercharge-your-career-prospects-with-e-commerce-and-cyber-security-courses,Singapore
Coronavirus-themed cyber attacks surge as more employees forced to work from home - The Straits Times,Straitstimes.com,18/3/2020,"When someone is working form their home it is a similar threat profile as at an airport or a Starbucks; you just don't have that protection you might have in the workplace;" Ms DeGrippo said. "And if we're at home with our family where we feel safe; you migh…,https://www.straitstimes.com/world/united-states/coronavirus-themed-cyberattacks-surge-as-more-employees-forced-to-work-from-home,World
Singapore stock watch: UOB; DBS; OCBC; SIA; Genting Singapore; IReit Global - The Straits Times,Straitstimes.com,18/3/2020,SINGAPORE (THE BUSINESS TIMES) - The following companies saw new developments that may affect trading of their securities on Wednesday (March 18):. Read more at straitstimes.com.,https://www.straitstimes.com/business/companies-markets/singapore-stock-watch-uob-dbs-ocbc-sia-genting-singapore-ireit-global,Business
Coming: Eco-friendly waste collection trucks; Singapore News & Top Stories - The Straits Times,Straitstimes.com,16/3/2020,New environmentally friendly and high-tech waste collection trucks are rolling out on April 1 to service about 151;000 households in the western part of Singapore.. Read more at straitstimes.com.,https://www.straitstimes.com/singapore/coming-eco-friendly-waste-collection-trucks,Singapore
US begins first human trial of coronavirus vaccine - The Straits Times,Straitstimes.com,16/3/2020,WASHINGTON (AFP) - The first human trial to evaluate a candidate vaccine against coronavirus disease 2019 has begun in Seattle; US health officials said Monday (March 16).. Read more at straitstimes.com.,https://www.straitstimes.com/world/united-states/us-begins-first-human-trial-of-coronavirus-vaccine,World
New eco-friendly dump trucks rolling out to households in western Singapore from April 1 - The Straits Times,Straitstimes.com,16/3/2020,SINGAPORE - New environmentally friendly and high-tech waste collection trucks are rolling out on April 1 to serve about 151;000 households in the western part of Singapore.. Read more at straitstimes.com.,https://www.straitstimes.com/singapore/new-eco-friendly-dump-trucks-rolling-out-to-households-in-western-singapore-from-april-1,Singapore
New curbs won't affect Malaysians; citizens entering S'pore via land; sea - The Straits Times,Straitstimes.com,15/3/2020,Singaporeans and Malaysians travelling into Singapore from Malaysia via land or sea will be exempted from the new border restrictions on Asean countries; due to the close proximity and high inter-dependency between the two neighbours.. Read more at straitstim…,https://www.straitstimes.com/singapore/health/new-curbs-wont-affect-malaysians-citizens-entering-spore-via-land-sea,Singapore
Coronavirus: Foreign maids entering Singapore to be issued stay-home notice; affected employers to get support,Straitstimes.com,15/3/2020,SINGAPORE - All foreign domestic workers entering Singapore will be served with a 14-day stay-home notice; the Ministry of Manpower (MOM) said on Sunday (March 15).. Read more at straitstimes.com.,https://www.straitstimes.com/singapore/health/coronavirus-foreign-domestic-workers-entering-singapore-to-be-issued-stay-home,Singapore
Singaporeans advised to defer all non-essential travel for next 30 days; as part of new Covid-19 measures - The Straits Times,Straitstimes.com,15/3/2020,All travellers entering Singapore with recent travel history to Asean countries; Japan; Switzerland or UK will be issued a 14-day stay-home notice.. Read more at straitstimes.com.,https://www.straitstimes.com/singapore/singapore-residents-advised-to-defer-all-non-essential-travel-for-next-30-days-as-part-of,Singapore
Coronavirus: Travellers from Malaysia via sea and land exempted from new border restrictions,Straitstimes.com,15/3/2020,SINGAPORE - Those travelling into Singapore from Malaysia via sea or land will be exempted from the new border restrictions on Asean countries; due to the close proximity and high inter-dependency between the two neighbours.. Read more at straitstimes.com.,https://www.straitstimes.com/singapore/health/coronavirus-travellers-from-malaysia-via-sea-and-land-exempted-from-new-border,Singapore
Coronavirus: Viral photo of nurse highlights plight of Italy's exhausted health workers - The Straits Times,Straitstimes.com,14/3/2020,ROME (AFP) - A worn-out nurse slumps over her keyboard in a widely shared image symbolic of the extreme fatigue that Italian health-care workers are facing as they battle Europe's worse outbreak of the novel coronavirus pandemic.. Read more at straitstimes.co…,https://www.straitstimes.com/world/europe/coronavirus-viral-photo-of-nurse-highlights-plight-of-italys-exhausted-health-workers,World
Bill Gates steps down from Microsoft board,Straitstimes.com,13/3/2020,NEW YORK (REUTERS) - Microsoft co-founder Bill Gates; who made the company one of the world's most valuable technology firms; stepped down from the board on Friday (March 13) to focus on philanthropic works related to global health; education and climate chan…,https://www.straitstimes.com/business/companies-markets/bill-gates-steps-down-from-microsoft-board,Business
Covid-19: S'pore rolls out more measures including limiting; where possible; size of gatherings to 250 people; workplace distancing,Straitstimes.com,13/3/2020,New measures include deferring or cancelling ticketed events with 250 participants or more; and asking employers to put in place measures such as staggering work hours.. Read more at straitstimes.com.,https://www.straitstimes.com/singapore/health/covid-19-singapore-rolls-out-more-measures-including-limiting-where-possible-the,Singapore
AIA reports slower new business value growth amid HK protests; coronavirus - The Straits Times,Straitstimes.com,12/3/2020,HONG KONG • Insurer AIA Group said yesterday that its growth in value of new business slowed to 6 per cent last year as anti-government protests in Hong Kong weighed on sales; and it signalled a brief but significant impact from the coronavirus outbreak.. Rea…,https://www.straitstimes.com/business/banking/aia-reports-slower-new-business-value-growth-amid-hk-protests-coronavirus,Business
Moving from manual labour to remote control tech - The Straits Times,Straitstimes.com,12/3/2020,Mr Rizal Johari; 28; is used to his work as a logistics assistant - a labour-intensive job that mostly involved the picking and packing of goods. However; the introduction of technology made his role obsolete last November; as processes became automated.. Rea…,https://www.straitstimes.com/singapore/manpower/moving-from-manual-labour-to-remote-control-tech,Singapore
China says coronavirus epidemic peak has passed...,Straitstimes.com,12/3/2020,China says coronavirus epidemic peak has passed... (First column; 11th story; link ) Related stories: Gun Sales Soar Among Asian Americans Who Fear Attacks... 'If Going To Die; Might as Well Do It At DISNEY WORLD'... SICK MAP... Drudge Report Feed needs your …,https://www.straitstimes.com/asia/east-asia/china-says-peak-of-coronavirus-epidemic-has-passed,World
