Coronavirus: 9 new cases confirmed; 5 imported cases,Straitstimes.com,12/3/2020,Five of these are imported cases; and one is linked to a previous case.. Read more at straitstimes.com.,https://www.straitstimes.com/singapore/health/coronavirus-9-new-cases-confirmed-5-imported-cases,Singapore
Coronavirus: How flattening the epidemic curve will buy time and keep outbreak in check - The Straits Times,Straitstimes.com,12/3/2020,Coronavirus: How flattening the epidemic curve will buy time and keep outbreak in check The Straits Times Two children in Canada have coronavirus: How the pandemic affects kids Global News 'Flattening the curve' on COVID-19 pandemic numbers; explained CTV New…,https://www.straitstimes.com/singapore/coronavirus-how-flattening-the-epidemic-curve-will-buy-time-and-keep-outbreak-in-check,Singapore
Firms must notify MOM if salaries hit by cost-cutting - The Straits Times,Straitstimes.com,11/3/2020,Employers must notify the Ministry of Manpower (MOM) if cost-cutting measures taken during the current slowdown have affected workers' salaries; and indicate that they have done so fairly.. Read more at straitstimes.com.,https://www.straitstimes.com/singapore/manpower/firms-must-notify-mom-if-salaries-hit-by-cost-cutting,Singapore
Preventing large-scale job losses top of Manpower Ministry's priority list; says Josephine Teo - The Straits Times,Straitstimes.com,11/3/2020,SINGAPORE - Ensuring that workers keep their jobs even as the fallout from the coronavirus outbreak clouds the economic outlook is at the top of the Ministry of Manpower's (MOM) priority list; Manpower Minister Josephine Teo said on Wednesday (March 11).. Rea…,https://www.straitstimes.com/singapore/manpower/preventing-large-scale-job-losses-top-of-manpower-ministrys-priority-list-says,Singapore
Fortunes flip for tech firms in Penang amid outbreak - The Straits Times,Straitstimes.com,10/3/2020,PENANG • Tech firms in Penang; Malaysia's one-time Silicon Valley of the East; swimming in orders from customers fleeing trade war-hit China; have seen fortunes turn again in the space of just a year as the coronavirus outbreak cuts them off from Chinese supp…,https://www.straitstimes.com/business/economy/fortunes-flip-for-tech-firms-in-penang-amid-outbreak,Business
1 in 5 patients went out or carried on with work despite being ill,Straitstimes.com,10/3/2020,One in five confirmed coronavirus patients here went out despite being unwell; said Health Minister Gan Kim Yong yesterday.. Read more at straitstimes.com.,https://www.straitstimes.com/singapore/health/1-in-5-patients-went-out-or-carried-on-with-work-despite-being-ill,Singapore
Coronavirus: Govt agencies to suspend activities for seniors for 14 days to cut risk of transmission,Straitstimes.com,10/3/2020,This comes amid a growing number of infections linked to a Chinese New Year dinner at Safra Jurong.. Read more at straitstimes.com.,https://www.straitstimes.com/singapore/health/govt-agencies-to-suspend-activities-for-seniors-for-14-days-starting-march-11-to,Singapore
Honestbee retrenches 80% of staff; delays payment of salaries and CPF contributions,Straitstimes.com,10/3/2020,SINGAPORE - Struggling start-up Honestbee has retrenched about 80 per cent of its staff; in the wake of the temporary closure of its grocery store Habitat.. Read more at straitstimes.com.,https://www.straitstimes.com/business/companies-markets/honestbee-terminates-80-of-staff-delays-payment-of-salaries-and-cpf,Business
Masks in luggage: How a Malaysian tech firm reopened its China factory - The Straits Times,Straitstimes.com,10/3/2020,PENANG (REUTERS) - When news of the coronavirus outbreak spread around the world in January; officials of the Malaysian tech company Qdos quickly realised what they needed to do to keep their factory in China running: get enough surgical masks for the 800 sta…,https://www.straitstimes.com/business/companies-markets/masks-in-luggage-how-a-malaysian-tech-firm-reopened-its-china-factory,Business
In Penang; fortunes flip for tech firms as coronavirus wrecks trade war gains - The Straits Times,Straitstimes.com,10/3/2020,PENANG (REUTERS) - Tech firms in Penang; Malaysia's one-time Silicon Valley of the East; swimming in orders from customers fleeing trade war-hit China; have seen fortunes turn again in the space of just a year as the coronavirus outbreak cuts them off from Ch…,https://www.straitstimes.com/business/economy/in-penang-fortunes-flip-for-tech-firms-as-coronavirus-wrecks-trade-war-gains,Business
Coronavirus: WHO praises Singapore's containment of Covid-19 outbreak,Straitstimes.com,10/3/2020,"Singapore is a good example of an all-of-government approach - Prime Minister Lee Hsien Loong's regular videos are helping to explain the risks and reassure people;" said Dr Tedros.. Read more at straitstimes.com.,https://www.straitstimes.com/singapore/health/coronavirus-who-praises-singapores-containment-of-covid-19-outbreak,Singapore
Singapore business confidence falls to record low on coronavirus worries: Survey - The Straits Times,Straitstimes.com,10/3/2020,Business sentiment tumbled to -7.88 percentage points in Q2 2020 from 5.31 percentage points in Q1 2020 as all six of the study's indicators reported negative numbers.. Read more at straitstimes.com.,https://www.straitstimes.com/business/economy/singapore-business-confidence-falls-to-record-low-on-coronavirus-worries-survey,Business
Coronavirus: Passengers begin disembarking from Costa Fortuna ship at Marina Bay Cruise Centre,Straitstimes.com,10/3/2020,The first group of passengers left the ship at about 8.40am and were then escorted by officials to a waiting bus.. Read more at straitstimes.com.,https://www.straitstimes.com/singapore/health/coronavirus-cruise-ship-turned-away-at-other-ports-docks-at-marina-bay-cruise,Singapore
S'pore will continue to accept cruise ships despite higher risk of spread,Straitstimes.com,9/3/2020,Singapore will continue to accept ships that are based here; including cruise ships; said the Health Ministry's director of medical services Kenneth Mak yesterday.. Read more at straitstimes.com.,https://www.straitstimes.com/singapore/health/spore-will-continue-to-accept-cruise-ships-despite-higher-risk-of-spread,Singapore
Coronavirus: Covid-19 likely to last till end-2020 at least: Experts,Straitstimes.com,9/3/2020,SINGAPORE - The number of people diagnosed with Covid-19 is growing around the world; and as the epicentre of the outbreak shifts away from China; it is unlikely that the disease will taper off like Sars did; said experts on Monday (March 9).. Read more at st…,https://www.straitstimes.com/singapore/health/coronavirus-covid-19-likely-to-last-till-end-2020-at-least-experts,Singapore
Singtel freezing wages of all staff this year; except for operational and support workers,Straitstimes.com,9/3/2020,Group chief executive Chua Sock Koong said that the company needed to brace itself for uncertainty because of the coronavirus outbreak and the weak business sentiment.. Read more at straitstimes.com.,https://www.straitstimes.com/business/companies-markets/singtel-freezing-wages-of-all-staff-this-year-except-for-operational-and,Business
Coronavirus: Philippines declares health emergency amid fears of community spread,Straitstimes.com,9/3/2020,MANILA - The Philippines has declared a "health emergency" amid growing anxiety that a deadly coronavirus is already spreading undetected in the capital Manila and in nearby suburbs.. Read more at straitstimes.com.,https://www.straitstimes.com/asia/se-asia/coronavirus-philippines-declares-health-emergency-amid-fears-of-community-spread,World
Covid 19: Italian cruise ship will dock in Singapore as scheduled; passengers to undergo health checks before disembarking,Straitstimes.com,9/3/2020,Covid 19: Italian cruise ship will dock in Singapore as scheduled; passengers to undergo health checks before disembarking straitstimes.com,https://www.straitstimes.com/singapore/transport/italian-cruise-ship-rejected-by-thailand-malaysia-over-covid-19-fears-will-dock,Singapore
Sats announces more pay cuts; warns of 'substantial' financial hit from coronavirus,Straitstimes.com,9/3/2020,SINGAPORE (THE BUSINESS TIMES) - Sats on Monday (March 9) announced a 15 per cent pay cut for its president and chief executive Alex Hungate amid a series of further cuts which took effect from March 1. Non-executive directors' fees were also reduced by 15 pe…,https://www.straitstimes.com/business/companies-markets/sats-announces-more-pay-cuts-warns-of-substantial-financial-hit-from,Business
Oil dives 31% in worst loss since 1991 Gulf War as price war erupts; stock futures plunge,Straitstimes.com,8/3/2020,Asian share markets were also set for a beating on Monday; with Nikkei futures down 4.5 per cent and trading 1;200 points below the cash close on Friday.. Read more at straitstimes.com.,https://www.straitstimes.com/business/companies-markets/oil-dives-31-in-worst-loss-since-1991-gulf-war-as-price-war-erupts-stock,Business
More 'aggressive' Covid-19 strain more prevalent in Wuhan: Study - The Straits Times,Straitstimes.com,8/3/2020,More 'aggressive' Covid-19 strain more prevalent in Wuhan: Study The Straits Times WHO statement on cases of COVID-19 surpassing 100 000 World Health Organization Opinion | It makes no sense for us to panic over the coronavirus Livemint Scientists may have fo…,https://www.straitstimes.com/asia/east-asia/more-aggressive-covid-19-strain-more-prevalent-in-wuhan-study,World
Catching the invisible criminal; Covid-19: How the police work on contact tracing,Straitstimes.com,8/3/2020,About 30 to 50 police officers are on contact-tracing duty on any given day; although police said numbers can be scaled quickly to 100 if the need arises.. Read more at straitstimes.com.,https://www.straitstimes.com/singapore/health/catching-the-invisible-criminal-covid-19-how-the-police-work-on-contact-tracing,Singapore
